{
  "$schema": "https://json-schema.org/draft/2020-12/schema",
  "$ref": "#/$defs/Notes",
  "$defs": {
    "Notes": {
      "type": "object",
      "properties": {
        "schema_version": {
          "$ref": "#/$defs/SchemaVersion"
        },
        "artefact": {
          "type": "string",
          "pattern": "^notes\\.(guitar|bass|piano|vocals|other)$"
        },
        "artefact_version": {
          "type": "integer",
          "exclusiveMinimum": 0,
          "maximum": 9007199254740991
        },
        "analysis_id": {
          "type": "string",
          "format": "uuid",
          "pattern": "^([0-9a-fA-F]{8}-[0-9a-fA-F]{4}-[1-8][0-9a-fA-F]{3}-[89abAB][0-9a-fA-F]{3}-[0-9a-fA-F]{12}|00000000-0000-0000-0000-000000000000|ffffffff-ffff-ffff-ffff-ffffffffffff)$"
        },
        "user_id": {
          "type": "string",
          "minLength": 1
        },
        "audio_hash": {
          "$ref": "#/$defs/Sha256Hex"
        },
        "sample_rate": {
          "type": "number",
          "const": 44100
        },
        "duration_s": {
          "type": "number",
          "exclusiveMinimum": 0
        },
        "models": {
          "type": "array",
          "items": {
            "$ref": "#/$defs/ModelRef"
          }
        },
        "params": {
          "type": "object",
          "propertyNames": {
            "type": "string"
          },
          "additionalProperties": {}
        },
        "created_at": {
          "type": "string",
          "format": "date-time",
          "pattern": "^(?:(?:\\d\\d[2468][048]|\\d\\d[13579][26]|\\d\\d0[48]|[02468][048]00|[13579][26]00)-02-29|\\d{4}-(?:(?:0[13578]|1[02])-(?:0[1-9]|[12]\\d|3[01])|(?:0[469]|11)-(?:0[1-9]|[12]\\d|30)|(?:02)-(?:0[1-9]|1\\d|2[0-8])))T(?:(?:[01]\\d|2[0-3]):[0-5]\\d:[0-5]\\d(?:\\.\\d+)?(?:Z))$"
        },
        "instrument": {
          "$ref": "#/$defs/Instrument"
        },
        "notes": {
          "type": "array",
          "items": {
            "$ref": "#/$defs/Note"
          }
        },
        "f0": {
          "$ref": "#/$defs/F0Track"
        }
      },
      "required": [
        "schema_version",
        "artefact",
        "artefact_version",
        "analysis_id",
        "user_id",
        "audio_hash",
        "sample_rate",
        "duration_s",
        "models",
        "params",
        "created_at",
        "instrument",
        "notes"
      ]
    },
    "SchemaVersion": {
      "type": "string",
      "pattern": "^1\\.\\d+\\.\\d+$"
    },
    "Sha256Hex": {
      "type": "string",
      "pattern": "^[0-9a-f]{64}$"
    },
    "ModelRef": {
      "type": "object",
      "properties": {
        "model_id": {
          "type": "string",
          "minLength": 1
        },
        "version": {
          "type": "string",
          "minLength": 1
        },
        "weights_sha256": {
          "$ref": "#/$defs/Sha256Hex"
        },
        "provider": {
          "type": "string",
          "enum": [
            "self_hosted",
            "vendor"
          ]
        },
        "register_tier": {
          "type": "string",
          "enum": [
            "green",
            "amber",
            "red"
          ]
        }
      },
      "required": [
        "model_id",
        "version",
        "weights_sha256",
        "provider",
        "register_tier"
      ]
    },
    "Instrument": {
      "type": "string",
      "enum": [
        "guitar",
        "bass",
        "piano",
        "drums",
        "vocals",
        "other"
      ]
    },
    "Note": {
      "type": "object",
      "properties": {
        "confidence": {
          "type": "number",
          "minimum": 0,
          "maximum": 1
        },
        "confidence_raw": {
          "type": "number"
        },
        "id": {
          "type": "string",
          "minLength": 1
        },
        "onset_s": {
          "type": "number",
          "minimum": 0
        },
        "offset_s": {
          "type": "number",
          "minimum": 0
        },
        "pitch_midi": {
          "type": "integer",
          "minimum": 21,
          "maximum": 108
        },
        "velocity": {
          "type": "integer",
          "minimum": 1,
          "maximum": 127
        },
        "bend_cents": {
          "type": "array",
          "items": {
            "type": "array",
            "prefixItems": [
              {
                "type": "number"
              },
              {
                "type": "number"
              }
            ],
            "items": false,
            "minItems": 2,
            "maxItems": 2
          }
        },
        "stem_id": {
          "type": "string",
          "minLength": 1
        },
        "low_band_energy": {
          "type": "number",
          "minimum": 0,
          "maximum": 1
        }
      },
      "required": [
        "confidence",
        "id",
        "onset_s",
        "offset_s",
        "pitch_midi",
        "stem_id"
      ]
    },
    "F0Track": {
      "type": "object",
      "properties": {
        "hop_s": {
          "type": "number",
          "exclusiveMinimum": 0
        },
        "hz": {
          "type": "array",
          "items": {
            "type": "number",
            "minimum": 0
          }
        },
        "voicing_prob": {
          "type": "array",
          "items": {
            "type": "number",
            "minimum": 0,
            "maximum": 1
          }
        }
      },
      "required": [
        "hop_s",
        "hz",
        "voicing_prob"
      ]
    }
  },
  "title": "Notes"
}
